Ticker,Name,Last Sale,Net Change,% Change,Market Cap,Country,IPO Year,Volume,Sector,Industry
DAO,Youdao Inc. American Depositary Shares each representing one Class A Ordinary Share,$24.05,-0.3,-1.23%,2981741992,,2019,249727,Consumer Services,Other Consumer Services
DAR,Darling Ingredients Inc. Common Stock,$68.46,-0.99,-1.43%,11170767511,United States,,1131426,Consumer Non-Durables,Farming/Seeds/Milling
DASH,DoorDash Inc. Class A Common Stock,$150.28,-2.54,-1.66%,48966912699,,2020,2238403,Capital Goods,Industrial Machinery/Components
DAVA,Endava plc American Depositary Shares (each representing one Class A Ordinary Share),$102.58,-0.85,-0.82%,5653937250,,2018,118109,Technology,EDP Services
DB,Deutsche Bank AG Common Stock,$15.09,0.06,0.40%,31616568000,Germany,,3406589,Finance,Commercial Banks
DBD,Diebold Nixdorf Incorporated Common Stock,$13.54,-0.3,-2.17%,1059210600,United States,,329996,Technology,EDP Services
DBI,Designer Brands Inc. Class A Common Stock,$17.49,-1.12,-6.02%,1268263196,United States,,1909525,Consumer Services,Clothing/Shoe/Accessory Stores
DBL,DoubleLine Opportunistic Credit Fund Common Shares of Beneficial Interest,$19.61,-0.09,-0.46%,293554209,United States,2012,23629,,
DCF,BNY Mellon Alcentra Global Credit Income 2024 Target Term Fund Inc. Common Stock,$9.56,-0.03,-0.31%,143047542,,2017,31294,,
DCI,Donaldson Company Inc. Common Stock,$61.59,0,0.00%,7767949198,United States,,682970,Capital Goods,Pollution Control Equipment
DCO,Ducommun Incorporated Common Stock,$53.77,1.25,2.38%,637152831,United States,,86703,Capital Goods,Military/Government/Technical
DCP,DCP Midstream  LP Common Units ,$25.17,-0.43,-1.68%,5244485937,United States,,1082584,Public Utilities,Natural Gas Distribution
DCP^B,DCP Midstream LP 7.875% Series B Fixed-to-Floating Rate Cumulative Redeemable Perpetual Preferred Units,$24.18,-0.27,-1.10%,,United States,,20066,,
DCP^C,DCP Midstream LP 7.95% Series C Fixed-to-Floating Rate Cumulative Redeemable Perpetual Preferred Units,$24.72,0.0111,0.05%,,United States,,13880,,
DCUE,Dominion Energy Inc. 2019 Series A Corporate Units,$99.50,0.63,0.64%,0,United States,2019,39041,Public Utilities,Electric Utilities: Central
DD,DuPont de Nemours Inc. Common Stock,$84.59,-0.13,-0.15%,45013920202,,2017,2248548,Capital Goods,Wholesale Distributors
DDD,3D Systems Corporation Common Stock,$29.41,-1.48,-4.79%,3677713412,United States,,6970475,Technology,Computer peripheral equipment
DDF,Delaware Investments Dividend & Income Fund Inc. Common Stock,$11.47,0.14,1.24%,87299994,United States,1993,25739,,
DDS,Dillard's Inc. Common Stock,$131.91,-1.25,-0.94%,2822874000,United States,,199913,Consumer Services,Department/Specialty Retail Stores
DDT,Dillard's Capital Trust I,$25.99,-0.11,-0.42%,0,United States,,24042,Consumer Services,Department/Specialty Retail Stores
DE,Deere & Company Common Stock,$361.10,-1.11,-0.31%,1.13183E+11,United States,,1348151,Capital Goods,Industrial Machinery/Components
DEA,Easterly Government Properties Inc. Common Stock,$20.73,0.1,0.49%,1738644856,United States,2015,307250,Consumer Services,Real Estate Investment Trusts
DECK,Deckers Outdoor Corporation Common Stock,$335.44,-3.67,-1.08%,9449317965,United States,1993,261047,Consumer Non-Durables,Shoe Manufacturing
DEH,D8 Holdings Corp. Class A Ordinary Shares,$9.89,0,0.00%,426506250,Hong Kong,2020,192610,Finance,Business Services
DEI,Douglas Emmett Inc. Common Stock,$34.72,0.43,1.25%,6092341246,United States,2006,955398,Consumer Services,Real Estate Investment Trusts
DELL,Dell Technologies Inc. Class C Common Stock ,$98.64,-1.06,-1.06%,75329324672,,2018,3296930,Technology,Computer Manufacturing
DEN,Denbury Inc. Common Stock,$67.02,1.07,1.62%,3351445214,,2020,646609,Energy,Oil & Gas Production
DEO,Diageo plc Common Stock,$193.25,0.35,0.18%,1.12995E+11,United Kingdom,,311326,Consumer Non-Durables,Beverages (Production/Distribution)
DESP,Despegar.com Corp. Ordinary Shares,$14.62,0.34,2.38%,1024852175,,2017,336164,Transportation,Other Consumer Services
DEX,Delaware Enhanced Global Dividend Common Shares of Beneficial Interest,$10.465,0.045,0.43%,124517792,United States,2007,55818,,
DFIN,Donnelley Financial Solutions Inc. Common Stock ,$29.81,-0.03,-0.10%,997597374,,2016,208954,Finance,Investment Managers
DFNS,LGL Systems Acquisition Corp. Common Stock,$9.95,0,0.00%,214546875,United States,2020,19015,,
DFP,Flaherty & Crumrine Dynamic Preferred and Income Fund Inc. Common Stock,$29.45,0.19,0.65%,565504437,,2013,40253,,
DFS,Discover Financial Services Common Stock,$117.26,-0.76,-0.64%,35751111416,United States,,1182625,Finance,Finance: Consumer Services
DG,Dollar General Corporation Common Stock,$202.96,-1.43,-0.70%,48561072586,United States,2009,2730170,Consumer Services,Department/Specialty Retail Stores
DGNR,Dragoneer Growth Opportunities Corp. Class A Ordinary Shares,$9.94,-0.04,-0.40%,857325000,United States,2020,147563,Finance,Business Services
DGX,Quest Diagnostics Incorporated Common Stock,$131.67,-0.89,-0.67%,16006563224,United States,,871568,Health Care,Medical Specialities
DHF,BNY Mellon High Yield Strategies Fund Common Stock,$3.14,-0.03,-0.95%,228302140,United States,1998,1092578,,
DHI,D.R. Horton Inc. Common Stock,$95.29,-0.29,-0.30%,34350475288,United States,,1699975,,
DHR,Danaher Corporation Common Stock,$256.14,0.91,0.36%,1.82699E+11,United States,,2068078,Health Care,Medical Specialities
DHR^A,Danaher Corporation 4.75% Mandatory Convertible Preferred Stock Series A,$1737.00,15.8,0.92%,,United States,,29404,,
DHR^B,Danaher Corporation 5.00% Mandatory Convertible Preferred Stock Series B,$1435.03,32.27,2.30%,,United States,,3764,,
DHT,DHT Holdings Inc.,$6.40,0.24,3.90%,1097593626,Jersey,2005,4157641,Transportation,Marine Transportation
DHX,DHI Group Inc. Common Stock,$3.20,-0.2,-5.88%,166965322,United States,2007,115625,Technology,Diversified Commercial Services
DIAX,Nuveen Dow 30SM Dynamic Overwrite Fund Common Shares of Beneficial Interest,$17.10,-0.03,-0.18%,621874229,,2014,70177,,
DIN,Dine Brands Global Inc. Common Stock,$94.95,-0.09,-0.10%,1629089338,United States,,133645,Consumer Services,Restaurants
DIS,Walt Disney Company (The) Common Stock,$178.65,-0.39,-0.22%,3.24595E+11,United States,,7124607,Consumer Services,Movies/Entertainment
DK,Delek US Holdings Inc. Common Stock,$22.29,0.84,3.92%,1646689888,United States,2017,890143,Energy,Integrated oil Companies
DKL,Delek Logistics Partners L.P. Common Units representing Limited Partner Interests,$43.79,-1.14,-2.54%,1902383683,United States,2012,128239,Energy,Oil & Gas Production
DKS,Dick's Sporting Goods Inc Common Stock,$97.53,-1.23,-1.25%,8707519850,United States,2002,1776152,Consumer Services,Other Specialty Stores
DLB,Dolby Laboratories Common Stock,$97.54,0.95,0.98%,9886737309,United States,2005,381689,Technology,EDP Services
DLNG,Dynagas LNG Partners LP Common Units,$2.71,0.03,1.12%,99716637,Greece,,17171,,
DLNG^A,Dynagas LNG Partners LP 9.00% Series A Cumulative Redeemable Preferred Units,$25.50,0.1133,0.45%,,Greece,,5823,,
DLNG^B,Dynagas LNG Partners LP 8.75% Series B Fixed to Floating Rate Cumulative Redeemable Perpetual Preferred Units liquidation preference $25.00 per Uni,$24.11,0.31,1.30%,,Greece,,10108,,
DLR,Digital Realty Trust Inc. Common Stock,$151.56,1.39,0.93%,42677430600,United States,2004,800567,Consumer Services,Real Estate Investment Trusts
DLR^J,Digital Realty Trust Inc. 5.250% Series J Cumulative Redeemable Preferred Stock,$26.75,0.02,0.08%,,United States,,5437,,
DLR^K,Digital Realty Trust Inc. 5.850% Series K Cumulative Redeemable Preferred Stock par value $0.01 per share,$28.31,0.14,0.50%,,United States,,10184,,
DLR^L,Digital Realty Trust Inc. 5.200% Series L Cumulative Redeemable Preferred Stock,$27.76,0.13,0.47%,,United States,,33915,,
DLX,Deluxe Corporation Common Stock,$45.56,-0.01,-0.02%,1922703757,United States,,134759,Technology,Advertising
DLY,DoubleLine Yield Opportunities Fund Common Shares of Beneficial Interest,$19.92,0.12,0.61%,0,,2020,84206,,
DM,Desktop Metal Inc. Class A Common Stock,$13.21,-0.36,-2.65%,3378789163,,2019,3042285,Technology,Computer peripheral equipment
DMB,BNY Mellon Municipal Bond Infrastructure Fund Inc. Common Stock,$14.87,-0.0135,-0.09%,273448043,,2013,11396,,
DMO,Western Asset Mortgage Opportunity Fund Inc. Common Stock,$14.97,0.1,0.67%,165075897,United States,2010,35197,,
DMS,Digital Media Solutions Inc. Class A Ordinary Shares,$10.70,0.19,1.81%,655708444,United States,2018,19162,Technology,Advertising
DMYI,dMY Technology Group Inc. III Class A Common Stock,$9.98,0.05,0.50%,374250000,United States,2021,265568,,
DMYQ,dMY Technology Group Inc. IV Class A Common Stock,$9.85,-0.03,-0.30%,424781250,,2021,17815,,
DNB,Dun & Bradstreet Holdings Inc. Common Stock,$21.47,0.2,0.94%,9262357714,United States,2020,1317682,Technology,EDP Services
DNMR,Danimer Scientific Inc. Common Stock,$22.18,-1.1,-4.73%,1897199903,,2020,1945222,Consumer Non-Durables,Plastic Products
DNOW,NOW Inc. Common Stock,$10.47,0.09,0.87%,1154369881,,2014,430533,Energy,Metal Fabrications
DNP,DNP Select Income Fund Inc. Common Stock,$10.38,-0.02,-0.19%,3210560459,United States,1987,448898,,
DNZ,D and Z Media Acquisition Corp. Class A Common Stock,$9.77,0.09,0.93%,351109375,,2021,2376,,
DOC,Physicians Realty Trust Common Shares of Beneficial Interest,$18.13,-0.01,-0.06%,3906460494,United States,2013,2648249,Consumer Services,Real Estate Investment Trusts
DOCN,DigitalOcean Holdings Inc. Common Stock,$42.04,-0.64,-1.50%,4479928069,,2021,130298,Technology,Retail: Computer Software & Peripheral Equipment
DOOR,Masonite International Corporation Ordinary Shares (Canada),$119.55,0.14,0.12%,2929071357,Canada,,82586,,
DOV,Dover Corporation Common Stock,$150.50,0.25,0.17%,21661054436,United States,,491879,Capital Goods,Industrial Machinery/Components
DOW,Dow Inc. Common Stock ,$68.42,-0.24,-0.35%,51109017622,,2019,3812734,Basic Industries,Industrial Specialties
DPG,Duff & Phelps Utility and Infrastructure Fund Inc.,$14.88,0,0.00%,564395513,United States,2011,111198,,
DPZ,Domino's Pizza Inc Common Stock,$426.87,2.9,0.68%,16574676120,United States,2004,458350,Consumer Non-Durables,Food Distributors
DQ,DAQO New Energy Corp. American Depositary Shares each representing five ordinary shares,$74.38,-3.56,-4.57%,5467940080,China,2010,2119486,Technology,Semiconductors
DRD,DRDGOLD Limited American Depositary Shares,$12.74,0.4,3.24%,1089414968,South Africa,,303866,Basic Industries,Precious Metals
DRE,Duke Realty Corporation Common Stock,$46.46,0.33,0.72%,17421815644,United States,,1821854,Consumer Services,Real Estate Investment Trusts
DRH,Diamondrock Hospitality Company Common Stock,$9.68,-0.01,-0.10%,2035237085,United States,2005,1112104,Consumer Services,Real Estate Investment Trusts
DRH^A,Diamondrock Hospitality Company 8.250% Series A Cumulative Redeemable Preferred Stock,$29.05,0.26,0.90%,,United States,,1164,,
DRI,Darden Restaurants Inc. Common Stock,$143.23,1.37,0.97%,18740596197,United States,,1043396,Consumer Services,Restaurants
DRQ,Dril-Quip Inc. Common Stock,$33.53,-0.02,-0.06%,1187957640,United States,1997,66380,Energy,Metal Fabrications
DRUA,Dominion Energy Inc. 2016 Series A 5.25% Enhanced Junior Subordinated Notes due 2076,$25.38,0.015,0.06%,0,United States,2016,59221,,
DS,Drive Shack Inc.,$3.01,-0.03,-0.99%,277131233,United States,,1236779,Consumer Services,Movies/Entertainment
DS^B,Drive Shack Inc. Preferred Series B,$25.51,0,0.00%,,United States,,11771,,
DS^C,Drive Shack Inc. Preferred Series C,$25.4653,0,0.00%,,United States,,51,,
DS^D,Drive Shack Inc. Pfd Ser D,$24.73,0.18,0.73%,,United States,,4355,,
DSE,Duff & Phelps Select MLP and Midstream Energy Fund Inc.,$8.85,0.04,0.45%,23216692,United States,2014,23943,,
DSL,DoubleLine Income Solutions Fund Common Shares of Beneficial Interests,$18.30,0,0.00%,1866541952,,2013,215564,,
DSM,BNY Mellon Strategic Municipal Bond Fund Inc. Common Stock,$8.16,-0.04,-0.49%,403279530,United States,1989,118122,,
DSSI,Diamond S Shipping Inc. Common Stock ,$10.69,0.07,0.66%,433958722,,2019,118061,Consumer Services,Transportation Services
DSU,Blackrock Debt Strategies Fund Inc. Common Stock,$11.23,0.03,0.27%,523225993,United States,1998,105501,,
DSX,Diana Shipping inc. common stock,$4.47,0.05,1.13%,409161459,Greece,2005,808941,Transportation,Marine Transportation
DSX^B,Diana Shipping Inc. Perpetual Preferred Shares Series B (Marshall Islands),$26.0241,0,0.00%,,Greece,,50,,
DT,Dynatrace Inc. Common Stock,$51.74,0.23,0.45%,14649158514,United States,2019,958879,Technology,EDP Services
DTB,DTE Energy Company 2020 Series G 4.375% Junior Subordinated Debentures due 2080,$25.63,0.18,0.71%,0,United States,2020,53959,Public Utilities,Electric Utilities: Central
DTE,DTE Energy Company Common Stock,$137.99,0.05,0.04%,26732438544,United States,,744033,Public Utilities,Electric Utilities: Central
DTF,DTF Tax-Free Income Inc. Common Stock,$14.78,-0.06,-0.40%,103896985,United States,1991,1578,,
DTJ,DTE Energy Company 2016 Series B 5.375% Junior Subordinated Debentures due 2076,$25.06,-0.07,-0.28%,0,United States,2016,101575,,
DTLA^,Brookfield DTLA Inc. 7.625% Series A Cumulative Redeemable Preferred Stock,$15.04,0.9,6.37%,,,,6254,,
DTP,DTE Energy Company 6.25% Corporate Units,$51.05,0,0.00%,0,United States,,73317,Public Utilities,Electric Utilities: Central
DTW,DTE Energy Company 2017 Series E 5.25% Junior Subordinated Debentures due 2077,$25.97,0.01,0.04%,0,United States,2017,254195,,
DTY,DTE Energy Company 2016 Series F 6.00% Junior Subordinated Debentures due 2076,$25.55,-0.06,-0.23%,0,United States,2016,36149,,
DUK,Duke Energy Corporation (Holding Company) Common Stock,$100.22,0.21,0.21%,77091123770,United States,,2271191,Public Utilities,Power Generation
DUK^A,Duke Energy Corporation Depositary Shares each representing a 1/1000th interest in a share of 5.75% Series A Cumulative Redeemable Perpetual Preferred Stock,$27.97,0.22,0.79%,,United States,,83927,,
DUKB,Duke Energy Corporation 5.625% Junior Subordinated Debentures due 2078,$27.12,0.11,0.41%,0,United States,2018,59976,,
DUKH,Duke Energy Corporation 5.125% Junior Subordinated Debentures due 2073,$26.05,0.07,0.27%,0,United States,,39389,Public Utilities,Power Generation
DV,DoubleVerify Holdings Inc. Common Stock,$36.89,0.17,0.46%,5779908600,,2021,463351,Technology,Computer Software: Prepackaged Software
DVA,DaVita Inc. Common Stock,$120.07,-0.6,-0.50%,12751434000,United States,,480349,Health Care,Medical/Nursing Services
DVD,Dover Motorsports Inc. Common Stock,$2.25,-0.03,-1.32%,82002580,United States,1996,50096,Consumer Services,Services-Misc. Amusement & Recreation
DVN,Devon Energy Corporation Common Stock,$26.56,-0.09,-0.34%,17978464000,United States,,6134588,Energy,Oil & Gas Production
DWIN,Delwinds Insurance Acquisition Corp. Class A Common Stock,$9.77,0.02,0.21%,251956088,,2021,41341,,
DX,Dynex Capital Inc. Common Stock,$19.55,0.1,0.51%,603695574,United States,,197280,Consumer Services,Real Estate Investment Trusts
DX^C,Dynex Capital Inc. 6.900% Series C Fixed-to-Floating Rate Cumulative Redeemable Preferred Stock,$25.40,-0.05,-0.20%,,United States,,17996,,
DXC,DXC Technology Company Common Stock ,$37.92,-0.47,-1.22%,9654204215,,,1627128,Technology,EDP Services
DY,Dycom Industries Inc. Common Stock,$74.92,-0.14,-0.19%,2305939530,United States,,368981,Basic Industries,Water Supply
DYFN,Angel Oak Dynamic Financial Strategies Income Term Trust Common Shares of Beneficial Interest,$19.93,0.05,0.25%,80816150,,2020,14991,Finance,Finance/Investors Services
E,ENI S.p.A. Common Stock,$24.56,-0.08,-0.33%,43870909702,Italy,,157486,Energy,Oil & Gas Production
EAF,GrafTech International Ltd. Common Stock,$13.28,0.12,0.91%,3549276106,United States,2018,2982254,Consumer Durables,Metal Fabrications
EAI,Entergy Arkansas LLC First Mortgage Bonds 4.875% Series Due September 1 2066,$25.25,-0.06,-0.24%,0,United States,2016,29838,,
EARN,Ellington Residential Mortgage REIT Common Shares of Beneficial Interest,$12.27,-0.05,-0.41%,151455260,United States,2013,42991,Consumer Services,Real Estate Investment Trusts
EAT,Brinker International Inc. Common Stock,$61.45,-0.63,-1.02%,2811393911,United States,,1062012,Consumer Services,Restaurants
EB,Eventbrite Inc. Class A Common Stock,$20.30,-0.23,-1.12%,1902501039,United States,2018,1394691,Technology,EDP Services
EBF,Ennis Inc. Common Stock,$20.96,-0.04,-0.19%,547124833,United States,,63021,Consumer Services,Office Equipment/Supplies/Services
EBR,Centrais Electricas Brasileiras S A American Depositary Shares (Each representing one Common Share),$8.28,0.07,0.85%,12990747935,,2016,618883,Public Utilities,Electric Utilities: Central
EBS,Emergent Biosolutions Inc. Common Stock,$60.65,2.85,4.93%,3249959241,United States,2006,1534460,Health Care,Major Pharmaceuticals
EC,Ecopetrol S.A. American Depositary Shares,$11.94,0.24,2.05%,24546666724,Colombia,,760799,Energy,Oil & Gas Production
ECC           ,Eagle Point Credit Company Inc. Common Stock,$13.28,-0.1,-0.75%,429672939,United States,2014,124833,Finance,Trusts Except Educational Religious and Charitable
ECCB,Eagle Point Credit Company Inc. 7.75% Series B Term Preferred Stock due 2026,$25.68,-0.01,-0.04%,0,United States,2016,1696,Finance,Trusts Except Educational Religious and Charitable
ECCW,Eagle Point Credit Company Inc. 6.75% Notes due 2031,$25.66,0.06,0.23%,0,United States,2021,2818,Finance,Trusts Except Educational Religious and Charitable
ECCX,Eagle Point Credit Company Inc. 6.6875% Notes due 2028,$25.6612,0.1394,0.55%,0,United States,2018,994,,
ECCY,Eagle Point Credit Company Inc. 6.75% Notes due 2027,$25.60,-0.1581,-0.61%,0,United States,2017,155,,
ECL,Ecolab Inc. Common Stock,$215.08,-1.15,-0.53%,61499415132,United States,,1094661,Consumer Non-Durables,Package Goods/Cosmetics
ECOM          ,ChannelAdvisor Corporation Common Stock,$23.73,-0.37,-1.54%,705560578,United States,2013,140279,Technology,Computer Software: Prepackaged Software
ED,Consolidated Edison Inc. Common Stock,$77.24,0.37,0.48%,26478896048,United States,,1629027,Public Utilities,Power Generation
EDD,Morgan Stanley Emerging Markets Domestic Debt Fund Inc. Morgan Stanley Emerging Markets Domestic Debt Fund Inc. Common Stock,$6.29,0.03,0.48%,415719466,United States,2007,84069,,
EDF,Stone Harbor Emerging Markets Income Fund Common Shares of Beneficial Interest,$8.39,0,0.00%,139910549,United States,2010,60622,,
EDI,Stone Harbor Emerging Markets Total Income Fund Common Shares of Beneficial Interests,$8.86,0.02,0.23%,87520480,United States,2012,18919,,
EDN,Empresa Distribuidora Y Comercializadora Norte S.A. (Edenor) Empresa Distribuidora Y Comercializadora Norte S.A. (Edenor) American Depositary Shares,$3.84,0.07,1.86%,174039379,Argentina,2007,31104,Public Utilities,Electric Utilities: Central
EDR,Endeavor Group Holdings Inc. Class A Common Stock,$29.65,1.15,4.04%,7523695535,,2021,926313,Consumer Services,Movies/Entertainment
EDU,New Oriental Education & Technology Group Inc. Sponsored ADR representing 1 Ordinary Share (Cayman Islands),$10.23,-0.02,-0.20%,17407970240,China,2006,19654800,Miscellaneous,Other Consumer Services
EEA,The European Equity Fund Inc. Common Stock,$11.72,0.06,0.52%,82922422,United States,,16224,,
EEX,Emerald Holding Inc. Common Stock,$5.65,0.16,2.91%,407361689,United States,2017,100945,Technology,Advertising
EFC,Ellington Financial Inc. Common Stock ,$18.88,0.1,0.53%,826598194,United States,2010,573117,Finance,Real Estate
EFC^A,Ellington Financial Inc. 6.750% Series A Fixed-to-Floating Rate Cumulative Redeemable Preferred Stock,$25.32,0,0.00%,,United States,,4631,,
EFF,Eaton vance Floating-Rate Income Plus Fund Common Shares of Beneficial Interest,$16.38,-0.01,-0.06%,124593192,,2013,24772,Finance,Investment Managers
EFL,Eaton Vance Floating-Rate 2022 Target Term Trust Common Shares of Beneficial Interest,$9.41,0,0.00%,222279369,United States,2017,59665,,
EFR,Eaton Vance Senior Floating-Rate Fund Common Shares of Beneficial Interest,$14.19,0.04,0.28%,522877561,United States,2003,74070,,
EFT,Eaton Vance Floating Rate Income Trust Common Shares of Beneficial Interest,$14.28,0.02,0.14%,569253493,United States,2004,63710,,
EFX,Equifax Inc. Common Stock,$235.04,-0.47,-0.20%,28604961711,United States,,547193,Technology,Advertising
EGF,Blackrock Enhanced Government Fund Inc. Common Stock,$12.65,-0.09,-0.71%,53911466,United States,2005,9367,,
EGHT,8x8 Inc Common Stock,$23.55,-0.37,-1.55%,2587954881,United States,,515090,Technology,EDP Services
EGO,Eldorado Gold Corporation Ordinary Shares,$11.88,0.07,0.59%,2159867516,Canada,,1071362,Basic Industries,Precious Metals
EGP,EastGroup Properties Inc. Common Stock,$158.08,1.13,0.72%,6326604569,United States,,183395,Consumer Services,Real Estate Investment Trusts
EGY,VAALCO Energy Inc.  Common Stock,$2.76,0.11,4.15%,159888354,United States,,401279,Energy,Oil & Gas Production
EHC,Encompass Health Corporation Common Stock,$85.79,0.74,0.87%,8539743354,United States,,376370,Health Care,Medical Specialities
EHI,Western Asset Global High Income Fund Inc Common Stock,$10.40,-0.0396,-0.38%,236051889,United States,2003,13365,,
EHT,Eaton Vance 2021 Target Term Trust Common Shares of Beneficial Interest,$9.84,0.01,0.10%,211210719,United States,2016,40540,,
EIC,Eagle Point Income Company Inc. Common Stock,$15.45,-0.02,-0.13%,0,,2019,17165,Finance,Finance/Investors Services
EIG,Employers Holdings Inc Common Stock,$42.20,0.46,1.10%,1203636418,United States,2007,120173,Finance,Property-Casualty Insurers
EIX,Edison International Common Stock,$55.87,0.45,0.81%,21199204021,United States,,1344246,Public Utilities,Electric Utilities: Central
EL,Estee Lauder Companies Inc. (The) Common Stock,$306.52,2.97,0.98%,1.11117E+11,United States,1995,896507,Consumer Non-Durables,Package Goods/Cosmetics
ELAN,Elanco Animal Health Incorporated Common Stock,$35.98,0.11,0.31%,17018394749,United States,2018,2540247,Health Care,Major Pharmaceuticals
ELAT,Elanco Animal Health Incorporated 5.00% Tangible Equity Units,$54.15,0.49,0.91%,0,United States,2020,19032,Health Care,Major Pharmaceuticals
ELC,Entergy Louisiana Inc. Collateral Trust Mortgage Bonds 4.875 % Series due September 1 2066,$25.29,0.03,0.12%,0,United States,2016,20133,,
ELF,e.l.f. Beauty Inc. Common Stock,$28.00,-0.52,-1.82%,1434747916,United States,2016,704077,Consumer Non-Durables,Package Goods/Cosmetics
ELP,Companhia Paranaense de Energia (COPEL) American Depositary Shares (each representing one Unit consisting one Common Share and four non-voting Class B Preferred Shares),$5.96,0.34,6.05%,16309860350,Brazil,2021,997598,Public Utilities,Electric Utilities: Central
ELS,Equity Lifestyle Properties Inc. Common Stock,$70.86,0.5,0.71%,12918843664,United States,,1338016,Consumer Services,Real Estate Investment Trusts
ELVT,Elevate Credit Inc. Common Stock,$3.65,-0.09,-2.41%,130497282,United States,2017,134421,Finance,Finance Companies
ELY,Callaway Golf Company Common Stock,$36.92,-0.14,-0.38%,6818087397,United States,1992,1894208,Consumer Non-Durables,Recreational Products/Toys
EMD,Western Asset Emerging Markets Debt Fund Inc Common Stock,$13.97,0.04,0.29%,848621788,United States,,92322,,
EME,EMCOR Group Inc. Common Stock,$126.11,0.81,0.65%,6880107982,United States,,253601,Capital Goods,Engineering & Construction
EMF,Templeton Emerging Markets Fund Common Stock,$19.78,0.01,0.05%,319766309,United States,1987,21726,,
EMN,Eastman Chemical Company Common Stock,$125.40,0.29,0.23%,17094969659,United States,,587170,Basic Industries,Major Chemicals
EMO,ClearBridge Energy Midstream Opportunity Fund Inc. Common Stock,$22.13,-0.18,-0.81%,299849948,United States,2011,56359,,
EMP,Entergy Mississippi LLC First Mortgage Bonds 4.90% Series Due October 1 2066,$25.52,-0.05,-0.20%,0,United States,2016,25608,,
EMPW,Empower Ltd. Class A Ordinary Shares,$10.06,0.04,0.40%,314375000,United States,2020,249053,Finance,Business Services
EMR,Emerson Electric Company Common Stock,$95.69,0.24,0.25%,57385293000,United States,,2555518,Capital Goods,Industrial Machinery/Components
ENB,Enbridge Inc Common Stock,$38.48,-0.17,-0.44%,77944179295,Canada,,6133601,Energy,Oil & Gas Production
ENBA,Enbridge Inc 6.375% Fixed-to-Floating Rate Subordinated Notes Series 2018-B due 2078,$27.07,0,0.00%,0,Canada,2018,72498,,
ENBL,Enable Midstream Partners LP Common Units representing limited partner interests,$8.46,-0.04,-0.47%,3687427536,,2014,434376,,
ENIA,Enel Americas S.A. American Depositary Shares,$6.79,0.1,1.50%,14568854663,Chile,,1113481,Public Utilities,Electric Utilities: Central
ENIC,Enel Chile S.A. American Depositary Shares (Each representing 50 shares of Common Stock),$2.96,0.11,3.86%,4094660186,,2016,1003811,Public Utilities,Electric Utilities: Central
ENJ,Entergy New Orleans LLC First Mortgage Bonds 5.0% Series due December 1 2052,$25.455,-0.255,-0.99%,0,United States,,300,Public Utilities,Power Generation
ENLC,EnLink Midstream LLC Common Units representing Limited Partner Interests,$4.88,0.01,0.21%,2391472973,,,2636680,Public Utilities,Natural Gas Distribution
ENO,Entergy New Orleans LLC First Mortgage Bonds 5.50% Series due April 1 2066,$25.51,0.19,0.75%,0,United States,2016,15839,,
ENPC,Executive Network Partnering Corporation Class A Common Stock,$9.72,0.03,0.31%,431412480,,2020,22930,,
ENR,Energizer Holdings Inc. Common Stock,$46.04,0.13,0.28%,3147634866,United States,2015,262200,Basic Industries,Metal Fabrications
ENR^A,Energizer Holdings Inc. 7.50% Series A Mandatory Convertible Preferred Stock,$96.67,0.37,0.38%,,United States,,5825,,
ENS,EnerSys Common Stock,$94.24,-0.76,-0.80%,4029044605,United States,2004,257491,Consumer Non-Durables,Telecommunications Equipment
ENV,Envestnet Inc Common Stock,$71.97,0.62,0.87%,3916796105,United States,2010,378561,Technology,EDP Services
ENVA,Enova International Inc. Common Stock,$37.87,0.11,0.29%,1391782789,United States,2014,295851,Finance,Finance: Consumer Services
ENZ,Enzo Biochem Inc. Common Stock ($0.01 Par Value),$3.08,-0.07,-2.22%,148543986,United States,,228524,Health Care,Medical Specialities
