Ticker,Name,Last Sale,Net Change,% Change,Market Cap,Country,IPO Year,Volume,Sector,Industry
PCM,PCM Fund Inc. Common Stock,$11.76,0.13,1.12%,137006693,United States,1993,24870,,
PCN,Pimco Corporate & Income Strategy Fund Common Stock,$18.45,0.06,0.33%,750494525,United States,2001,52707,,
PCOR,Procore Technologies Inc. Common Stock,$86.42,4.12,5.01%,11073407169,,2021,644132,Technology,EDP Services
PCPC,Periphas Capital Partnering Corporation Class A Common Stock,$24.49,0,0.00%,434785664,,2021,25,,
PCQ,PIMCO California Municipal Income Fund Common Stock,$18.44,-0.03,-0.16%,348018120,United States,2001,18541,,
PD,PagerDuty Inc. Common Stock,$40.65,-0.49,-1.19%,3396626399,,2019,896521,Technology,Retail: Computer Software & Peripheral Equipment
PDAC,Peridot Acquisition Corp. Class A Ordinary Shares,$10.07,0.04,0.40%,377625000,United States,2020,215559,Finance,Business Services
PDI,PIMCO Dynamic Income Fund Common Stock,$28.76,0.09,0.31%,2000275630,United States,2012,309376,,
PDM,Piedmont Office Realty Trust Inc. Class A Common Stock,$18.49,0.18,0.98%,2293296228,United States,,420657,Consumer Services,Building operators
PDO,PIMCO Dynamic Income Opportunities Fund Common Shares of Beneficial Interest,$21.19,0.01,0.05%,1473777489,,2021,513082,,
PDOT,Peridot Acquisition Corp. II Class A Ordinary Shares,$9.80,-0.01,-0.10%,452871416,,2021,2597,,
PDS,Precision Drilling Corporation Common Stock,$31.66,0.15,0.48%,421218096,Canada,,24952,Energy,Oil & Gas Production
PDT,John Hancock Premium Dividend Fund,$16.65,0.13,0.79%,810688100,United States,,114038,,
PEAK,Healthpeak Properties Inc. Common Stock,$33.38,0.44,1.34%,17989609543,United States,,2217715,Consumer Services,Real Estate Investment Trusts
PEB,Pebblebrook Hotel Trust Common Shares of Beneficial Interest,$22.35,0.05,0.22%,2936460516,United States,2009,1038062,Consumer Services,Real Estate Investment Trusts
PEB^C,Pebblebrook Hotel Trust 6.50% Series C Cumulative Redeemable Preferred Shares of Beneficial Interest,$25.53,0.11,0.43%,,United States,,9220,,
PEB^D,Pebblebrook Hotel Trust 6.375% Series D Cumulative Redeemable Preferred Shares of Beneficial Interest,$25.35,0.16,0.64%,,United States,,18790,,
PEB^E,Pebblebrook Hotel Trust 6.375% Series E Cumulative Redeemable Preferred Shares of Beneficial Interest,$25.41,0.3599,1.44%,,United States,,2960,,
PEB^F,Pebblebrook Hotel Trust 6.3% Series F Cumulative Redeemable Preferred Shares of Beneficial Interest,$25.67,0.45,1.78%,,United States,,5553,,
PEB^G,Pebblebrook Hotel Trust 6.375% Series G Cumulative Redeemable Preferred Shares of Beneficial Interest,$25.84,0.11,0.43%,,United States,,842758,,
PEG,Public Service Enterprise Group Incorporated Common Stock,$62.12,0.09,0.15%,31400399337,United States,,1622756,Public Utilities,Electric Utilities: Central
PEI,Pennsylvania Real Estate Investment Trust Common Stock,$2.09,0.04,1.95%,165653216,United States,,1000350,Consumer Services,Real Estate Investment Trusts
PEI^B,Pennsylvania Real Estate Investment Trust Cumulative Redeemable Perpetual Preferred Shares Series B,$10.32,0.7101,7.39%,,United States,,34906,,
PEI^C,Pennsylvania Real Estate Investment Trust 7.20% Series C Cumulative Redeemable Perpetual Preferred Shares,$10.42,0.64,6.54%,,United States,,26264,,
PEI^D,Pennsylvania Real Estate Investment Trust 6.875% Series D Cumulative Redeemable Perpetual Preferred Shares,$10.38,0.79,8.24%,,United States,,27890,,
PEN,Penumbra Inc. Common Stock,$249.11,0.62,0.25%,9088119952,,2015,361583,Health Care,Medical/Dental Instruments
PEO,Adams Natural Resources Fund Inc. Common Stock,$15.80,-0.05,-0.32%,380439621,United States,,43409,,
PFD,Flaherty & Crumrine Preferred and Income Fund Incorporated,$16.95,-0.04,-0.24%,191999939,United States,1991,30869,,
PFE,Pfizer Inc. Common Stock,$38.73,0.08,0.21%,2.16799E+11,United States,,16153787,Health Care,Major Pharmaceuticals
PFGC,Performance Food Group Company Common Stock,$50.13,1.08,2.20%,6707686910,United States,2015,1375968,Consumer Non-Durables,Food Distributors
PFH,Prudential Financial Inc. 4.125% Junior Subordinated Notes due 2060,$25.75,0.1,0.39%,0,United States,2020,77286,,
PFL,PIMCO Income Strategy Fund Shares of Beneficial Interest,$12.66,0.08,0.64%,432990560,United States,2003,95118,,
PFN,PIMCO Income Strategy Fund II,$10.75,0.07,0.66%,823726168,United States,2004,175731,,
PFO,Flaherty & Crumrine Preferred and Income Opportunity Fund Incorporated,$13.16,0.06,0.46%,167760166,United States,1992,11279,,
PFS,Provident Financial Services Inc Common Stock,$25.26,-0.01,-0.04%,1969441242,United States,2003,269832,Finance,Savings Institutions
PFSI,PennyMac Financial Services Inc. Common Stock,$62.61,0.15,0.24%,4178228137,United States,2013,424867,Finance,Finance: Consumer Services
PG,Procter & Gamble Company (The) Common Stock,$134.85,-0.13,-0.10%,3.30144E+11,United States,,10477077,Consumer Non-Durables,Package Goods/Cosmetics
PGP,Pimco Global Stocksplus & Income Fund Pimco Global StocksPlus & Income Fund Common Shares of Beneficial Interest,$11.07,0.05,0.45%,122590741,United States,2005,19399,,
PGR,Progressive Corporation (The) Common Stock,$99.08,-0.07,-0.07%,57971708000,United States,,2109041,Finance,Property-Casualty Insurers
PGRE,Paramount Group Inc. Common Stock,$10.98,0.13,1.20%,2404077544,United States,2014,1742233,Consumer Services,Real Estate Investment Trusts
PGTI,PGT Innovations Inc.,$24.16,-0.09,-0.37%,1438602537,United States,2006,224026,Capital Goods,Building Products
PGZ,Principal Real Estate Income Fund Common Shares of Beneficial Interest,$15.63,0.29,1.89%,107320613,,2013,28343,Finance,Investment Managers
PH,Parker-Hannifin Corporation Common Stock,$308.15,0.07,0.02%,39768589452,United States,,718360,Capital Goods,Office Equipment/Supplies/Services
PHD,Pioneer Floating Rate Fund Inc.,$11.30,0.01,0.09%,279541366,United States,2004,47852,,
PHG,Koninklijke Philips N.V. NY Registry Shares,$56.48,1.02,1.84%,51130722720,Netherlands,,611961,Health Care,Biotechnology: Electromedical & Electrotherapeutic Apparatus
PHI,PLDT Inc. Sponsored ADR,$27.57,0.83,3.10%,5955120000,Philippines,,41298,Public Utilities,Telecommunications Equipment
PHK,Pimco High Income Fund Pimco High Income Fund,$6.82,0.02,0.29%,911144750,United States,2003,313976,,
PHM,PulteGroup Inc. Common Stock,$57.79,-0.09,-0.16%,15196812133,United States,,2566789,,
PHR,Phreesia Inc. Common Stock,$49.50,0.29,0.59%,2499247229,United States,2019,293048,Health Care,Managed Health Care
PHT,Pioneer High Income Fund Inc.,$10.10,0.07,0.70%,295240887,United States,,90118,,
PHX,PHX Minerals Inc. Common Stock,$2.86,-0.03,-1.04%,86947340,United States,,214835,Energy,Oil & Gas Production
PIAI,Prime Impact Acquisition I Class A Ordinary Shares,$9.71,-0.03,-0.31%,301535437,,2020,23125,Finance,Business Services
PICC,Pivotal Investment Corporation III Class A Common Stock,$9.80,-0.03,-0.31%,338100000,,2021,9742,,
PII,Polaris Inc. Common Stock,$131.22,-0.88,-0.67%,8036185213,United States,,470412,Consumer Non-Durables,Recreational Products/Toys
PIM,Putnam Master Intermediate Income Trust Common Stock,$4.24,0.03,0.71%,216984404,United States,1988,85140,,
PINE,Alpine Income Property Trust Inc. Common Stock,$18.23,0.19,1.05%,144609657,United States,2019,60620,Consumer Services,Real Estate Investment Trusts
PING,Ping Identity Holding Corp. Common Stock,$24.11,-0.07,-0.29%,1977791014,United States,2019,622402,Technology,EDP Services
PINS,Pinterest Inc. Class A Common Stock,$65.30,1,1.56%,41587021080,,2019,9624986,,
PIPP,Pine Island Acquisition Corp. Class A Common Stock,$9.79,0.04,0.41%,267252315,United States,2021,48700,,
PIPR,Piper Sandler Companies Common Stock,$127.46,-0.41,-0.32%,1832161661,United States,,31970,Finance,Investment Bankers/Brokers/Service
PJT,PJT Partners Inc. Class A Common Stock,$72.82,-0.56,-0.76%,3001668363,United States,2015,81970,Finance,Investment Managers
PK,Park Hotels & Resorts Inc. Common Stock ,$20.79,-0.35,-1.66%,4916637744,United States,2016,2140977,Consumer Services,Real Estate Investment Trusts
PKE,Park Aerospace Corp. Common Stock,$15.42,0.29,1.92%,314303948,United States,,74978,,
PKG,Packaging Corporation of America Common Stock,$148.65,-0.74,-0.50%,14120867911,United States,2000,382261,Basic Industries,Paper
PKI,PerkinElmer Inc. Common Stock,$145.07,0.17,0.12%,16261066757,United States,,507068,Health Care,Medical Specialities
PKO,Pimco Income Opportunity Fund Common Shares of Beneficial Interest,$26.72,-0.07,-0.26%,554962750,United States,,51481,,
PKX,POSCO Common Stock,$80.11,-0.48,-0.60%,24233458292,South Korea,1994,174900,Basic Industries,Steel/Iron Ore
PLAN,Anaplan Inc. Common Stock,$51.51,1.9,3.83%,7447497630,United States,2018,3991624,Technology,Computer Software: Prepackaged Software
PLD,Prologis Inc. Common Stock,$117.84,0.98,0.84%,87174850320,United States,,2870667,Consumer Services,Real Estate Investment Trusts
PLNT,Planet Fitness Inc. Common Stock,$78.77,-0.9,-1.13%,6820340071,United States,2015,445668,Consumer Services,Other Consumer Services
PLOW,Douglas Dynamics Inc. Common Stock,$43.85,1.06,2.48%,1006597447,United States,2010,105861,Capital Goods,Construction/Ag Equipment/Trucks
PLTR,Palantir Technologies Inc. Class A Common Stock,$22.95,0.25,1.10%,43071327700,,2020,111705064,Technology,Retail: Computer Software & Peripheral Equipment
PLYM,Plymouth Industrial REIT Inc. Common Stock,$19.14,0.03,0.16%,562808236,United States,2017,141424,Consumer Services,Real Estate Investment Trusts
PM,Philip Morris International Inc Common Stock,$96.43,-0.25,-0.26%,1.5029E+11,United States,,3746632,Consumer Non-Durables,Farming/Seeds/Milling
PMF,PIMCO Municipal Income Fund Common Stock,$14.75,-0.03,-0.20%,382629750,United States,2001,37941,,
PML,Pimco Municipal Income Fund II Common Shares of Beneficial Interest,$14.68,-0.01,-0.07%,924531720,United States,2002,35172,,
PMM,Putnam Managed Municipal Income Trust Common Stock,$8.44,-0.02,-0.24%,412547208,United States,1989,38570,,
PMO,Putnam Municipal Opportunities Trust Common Stock,$14.04,-0.07,-0.50%,478899991,United States,1993,84518,,
PMT,PennyMac Mortgage Investment Trust Common Shares of Beneficial Interest,$19.60,0.24,1.24%,1919591660,United States,2009,568552,Consumer Services,Real Estate Investment Trusts
PMT^A,PennyMac Mortgage Investment Trust 8.125% Series A Fixed-to-Floating Rate Cumulative Redeemable Preferred Shares of Beneficial Interest,$26.00,-0.36,-1.37%,,United States,,12079,,
PMT^B,PennyMac Mortgage Investment Trust 8.00% Series B Fixed-to-Floating Rate Cumulative Redeemable Preferred Shares of Beneficial Interest,$26.10,-0.65,-2.43%,,United States,,21342,,
PMVC,PMV Consumer Acquisition Corp. Class A Common Stock,$9.75,0.07,0.72%,213281250,United States,2020,58533,,
PMX,PIMCO Municipal Income Fund III Common Shares of Beneficial Interest,$12.32,0.03,0.24%,408469600,United States,2002,21354,,
PNC,PNC Financial Services Group Inc. (The) Common Stock,$194.68,0.56,0.29%,82711423383,United States,,857052,Finance,Major Banks
PNC^P,PNC Financial Services Group Inc. (The) Depositary Shares Representing 1/4000th Perpetual Preferred Series P,$26.12,-0.1,-0.38%,,United States,,891249,,
PNF,PIMCO New York Municipal Income Fund Common Stock,$12.54,0.04,0.32%,98175660,United States,2001,12578,,
PNI,Pimco New York Municipal Income Fund II Common Shares of Beneficial Interest,$11.85,0.26,2.24%,132589650,United States,2002,31105,,
PNM,PNM Resources Inc. (Holding Co.) Common Stock,$49.12,0.16,0.33%,4216209011,United States,,949920,Public Utilities,Electric Utilities: Central
PNR,Pentair plc. Ordinary Share,$68.97,-0.44,-0.63%,11462930697,Switzerland,,661729,Capital Goods,Fluid Controls
PNTM,Pontem Corporation Class A Ordinary Shares,$9.69,0.01,0.10%,835762500,,2021,36368,Finance,Business Services
PNW,Pinnacle West Capital Corporation Common Stock,$84.58,0.36,0.43%,9536476366,United States,,755601,Public Utilities,Electric Utilities: Central
POLY,Plantronics Inc. Common Stock,$32.80,0.11,0.34%,1372314805,United States,,467971,Public Utilities,Telecommunications Equipment
POR,Portland General Electric Co Common Stock,$47.94,0.23,0.48%,4295700039,United States,,334603,Public Utilities,Electric Utilities: Central
POST,Post Holdings Inc. Common Stock,$115.53,1.37,1.20%,7351153913,United States,2012,196781,Consumer Non-Durables,Specialty Foods
PPG,PPG Industries Inc. Common Stock,$179.72,-1.07,-0.59%,42610026690,United States,,883502,Basic Industries,Paints/Coatings
PPL,PPL Corporation Common Stock,$29.11,0.06,0.21%,22398045558,United States,,3727576,Public Utilities,Electric Utilities: Central
PPR,Voya Prime Rate Trust Shares of Beneficial Interest,$4.68,0,0.00%,572210168,United States,,573472,,
PPT,Putnam Premier Income Trust Common Stock,$4.70,0.025,0.54%,480397072,United States,1988,91144,,
PPX,PPL Capital Funding Inc. 2013 Series B Junior Subordinated Notes due 2073,$25.92,0.1,0.39%,0,,,33860,Public Utilities,Electric Utilities: Central
PQG,PQ Group Holdings Inc. Common Stock,$16.34,-0.01,-0.06%,2237345644,United States,2017,329888,Basic Industries,Major Chemicals
PRA,ProAssurance Corporation Common Stock,$24.35,-0.18,-0.73%,1313765266,United States,,124498,Finance,Property-Casualty Insurers
PRE^J,PartnerRe Ltd. 4.875% Fixed Rate Non-Cumulative Redeemable Preferred Shares Series J,$26.58,0.31,1.18%,,Bermuda,,13557,,
PRG,PROG Holdings Inc. Common Stock,$52.72,-1.1,-2.04%,3570161918,United States,,284527,Technology,Diversified Commercial Services
PRGO,Perrigo Company plc Ordinary Shares,$46.14,0.32,0.70%,6161953813,United States,,823419,Health Care,Major Pharmaceuticals
PRI,Primerica Inc. Common Stock,$162.21,2.33,1.46%,6397231654,United States,2010,116032,Finance,Life Insurance
PRIF^A,Priority Income Fund Inc. 6.375% Series A Term Preferred Stock due 2025,$25.09,-0.0093,-0.04%,,,,2268,,
PRIF^C,Priority Income Fund Inc. 6.625% Series C Term Preferred Stock due 2024 par value $0.01 per share,$25.33,0,0.00%,,,,301,,
PRIF^D,Priority Income Fund Inc. 7.00% Series D Term Preferred Stock due 2029,$25.45,-0.12,-0.47%,,,,718,,
PRIF^E,Priority Income Fund Inc. 6.375% Series E Preferred Stock Due 2024,$25.2099,-0.0501,-0.20%,,,,300,,
PRIF^F,Priority Income Fund Inc. 6.625% Series F Term Preferred Stock due 2027,$25.62,-0.03,-0.12%,,,,1563,,
PRIF^G,Priority Income Fund Inc. 6.25% Series G Preferred Stock Due 2026,$25.40,-0.3621,-1.41%,,,,8100,,
PRIF^H,Priority Income Fund Inc. 6.00% Series H Term Preferred Stock due 2026,$25.00,-0.02,-0.08%,,,,13959,,
PRLB,Proto Labs Inc. Common stock,$89.39,-2.45,-2.67%,2475186395,United States,2012,314887,Capital Goods,Office Equipment/Supplies/Services
PRMW,Primo Water Corporation Common Stock,$17.31,0.01,0.06%,2789197257,Canada,,738622,,
PRO,PROS Holdings Inc. Common Stock,$44.37,1.73,4.06%,1963499221,United States,2007,752606,Technology,EDP Services
PROS,ProSight Global Inc. Common Stock,$12.80,-0.01,-0.08%,560375245,United States,2019,156195,Finance,Property-Casualty Insurers
PRPB,CC Neuberger Principal Holdings II Class A Ordinary Shares,$9.83,0.02,0.20%,1066555000,United States,2020,154723,Finance,Business Services
PRPC,CC Neuberger Principal Holdings III Class A Ordinary Shares,$10.00,0.18,1.83%,553125000,,2021,28854,Finance,Business Services
PRS,Prudential Financial Inc. 5.625% Junior Subordinated Notes due 2058,$27.77,0.17,0.62%,945889716,United States,2018,45849,Finance,Investment Bankers/Brokers/Service
PRT,PermRock Royalty Trust Trust Units,$6.74,-0.09,-1.32%,81997034,United States,2018,23455,Energy,Oil & Gas Production
PRTY,Party City Holdco Inc. Common Stock,$9.23,-0.07,-0.75%,1027268504,United States,2015,1616317,Miscellaneous,Diversified Commercial Services
PRU,Prudential Financial Inc. Common Stock,$106.97,0.34,0.32%,42146180000,United States,2001,2181204,Finance,Life Insurance
PSA,Public Storage Common Stock,$282.48,2.61,0.93%,49427824987,United States,,1507520,Consumer Services,Real Estate Investment Trusts
PSA^C,Public Storage Depositary Shares Each Representing 1/1000 of a 5.125% Cumulative Preferred Share of Beneficial Interest Series C,$25.40,-0.34,-1.32%,,United States,,31072,,
PSA^D,Public Storage Depositary Shares Each Representing 1/1000 of a 4.95% Cumulative Preferred Share of Beneficial Interest Series D,$25.48,-0.12,-0.47%,,United States,,24831,,
PSA^E,Public Storage Depositary Shares Each Representing 1/1000 of a 4.90% Cumulative Preferred Share of Beneficial Interest Series E,$25.70,-0.065,-0.25%,,United States,,23699,,
PSA^F,Public Storage Depositary Shares Each Representing 1/1000 of a 5.15% Cumulative Preferred Share of Beneficial Interest Series F par value $0.01 per share,$26.59,-0.0028,-0.01%,,United States,,23904,,
PSA^G,Public Storage Depositary Shares Each Representing 1/1000 of a 5.05% Cumulative Preferred Share of Beneficial Interest Series G,$26.44,0,0.00%,,United States,,23924,,
PSA^H,Public Storage Depositary Shares Each Representing 1/1000 of a  5.60% Cumulative Preferred  Share of Beneficial Interest Series H,$27.99,-0.025,-0.09%,,United States,,38537,,
PSA^I,Public Storage Depositary Shares Each Representing 1/1000 of a 4.875% Cumulative Preferred Share of Beneficial Interest Series I par value $0.01 per share,$27.29,0.09,0.33%,,United States,,62471,,
PSA^J,Public Storage Depositary Shares Each Representing 1/1000 of a 4.700% Cumulative Preferred Share of Beneficial Interest Series J par value $0.01 per share,$27.24,0.1,0.37%,,United States,,18122,,
PSA^K,Public Storage Depositary Shares Each Representing 1/1000 of a 4.75% Cumulative Preferred Share of Beneficial Interest Series K,$27.72,0.18,0.65%,,United States,,9634,,
PSA^L,Public Storage Depositary Shares Each Representing 1/1000 of a 4.625% Cumulative Preferred Share of Beneficial Interest Series L par value $0.01 per share,$26.97,0.22,0.82%,,United States,,61719,,
PSA^M,Public Storage Depositary Shares Each Representing 1/1000 of a 4.125% Cumulative Preferred Share of Beneficial Interest Series M,$26.00,0.16,0.62%,,United States,,9615,,
PSA^N,Public Storage Depositary Shares Each Representing 1/1000 of a 3.875% Cumulative Preferred Share of Beneficial Interest Series N,$25.66,0.07,0.27%,,United States,,21657,,
PSA^O,Public Storage Depositary Shares Each Representing 1/1000 of a 3.900% Cumulative Preferred Share of Beneficial Interest Series O,$25.77,0.31,1.22%,,United States,,50241,,
PSB,PS Business Parks Inc. (MD) Common Stock,$154.96,-0.23,-0.15%,4265894925,United States,,90697,Consumer Services,Real Estate Investment Trusts
PSB^W,PS Business Parks Inc. Depositary Shares Each Representing 1/1000 of a Share of 5.20% Cumulative Preferred Stock Series W,$25.94,0.24,0.93%,,United States,,9190,,
PSB^X,PS Business Parks Inc. Depositary Shares Each Representing 1/1000 of a Share of 5.25% Cumulative Preferred Stock Series X,$26.66,-0.09,-0.34%,,United States,,13713,,
PSB^Y,PS Business Parks Inc. 5.20% Cumulative Preferred Stock Series Y,$26.60,0.1,0.38%,,United States,,12012,,
PSB^Z,PS Business Parks Inc. Depositary Shares Each Representing 1/1000 of a Share of 4.875% Cumulative Preferred Stock Series Z  par value $0.01 per share,$27.10,0.19,0.71%,,United States,,20709,,
PSF,Cohen & Steers Select Preferred and Income Fund Inc. Common Stock,$29.66,-0.05,-0.17%,356412000,,2010,25324,,
PSFE,Paysafe Limited Common Shares,$11.22,-0.1,-0.88%,8120052926,,2021,3838708,Miscellaneous,Business Services
PSN,Parsons Corporation Common Stock,$39.61,-0.42,-1.05%,4056404963,,2019,218583,Capital Goods,Industrial Machinery/Components
PSO,Pearson Plc Common Stock,$11.68,-0.18,-1.52%,8832817442,United Kingdom,,293029,Consumer Services,Books
PSTG,Pure Storage Inc. Class A Common Stock,$19.05,-0.04,-0.21%,5396672919,,2015,4459800,Technology,Electronic Components
PSTH,Pershing Square Tontine Holdings Ltd. Class A Common Stock,$25.12,0.48,1.95%,5024002512,,2020,2328860,,
PSTL,Postal Realty Trust Inc. Class A Common Stock,$20.21,0.07,0.35%,270224313,,2019,105145,Consumer Services,Real Estate Investment Trusts
PSX,Phillips 66 Common Stock,$84.22,-0.19,-0.23%,36877163288,United States,,1722918,Energy,Integrated oil Companies
PSXP,Phillips 66 Partners LP Common Units representing limited partner interest in the Partnership,$40.08,-0.55,-1.35%,9151873052,United States,2013,887253,Energy,Oil & Gas Production
PTA,Cohen & Steers Tax-Advantaged Preferred Securities and Income Fund Common Shares of Beneficial Interest,$25.00,0.01,0.04%,1381836425,,2020,163346,,
PTR,PetroChina Company Limited Common Stock,$41.25,0.44,1.08%,75496153343,China,,182450,Energy,Oil & Gas Production
PTY,Pimco Corporate & Income Opportunity Fund,$19.87,0.09,0.46%,2197954048,United States,2002,311319,,
PUK,Prudential Public Limited Company Common Stock,$42.71,-0.16,-0.37%,55856323490,United Kingdom,,165421,Finance,Life Insurance
PUK^,Prudential Public Limited Company 6.75% Perpetual Subordinated Captial Security,$27.67,0.34,1.24%,,United Kingdom,,15314,,
PUK^A,Prudential Public Limited Company 6.50% Perpetual Subordinated Capital Securities Exchangeable at the Issuer's Option Into Non-Cumulative Dollar Denominated Preference Shares,$27.37,0.25,0.92%,,United Kingdom,,13382,,
PUMP,ProPetro Holding Corp. Common Stock,$9.94,-0.04,-0.40%,1016666490,United States,2017,364156,Energy,Oilfield Services/Equipment
PV,Primavera Capital Acquisition Corporation Class A Ordinary Shares,$9.66,0.01,0.10%,519225000,,2021,59741,Finance,Business Services
PVG,Pretium Resources Inc. Ordinary Shares (Canada),$11.40,0.07,0.62%,2141297158,Canada,,677335,,
PVH,PVH Corp. Common Stock,$114.82,-1.81,-1.55%,8182757298,United States,,815815,,
PVL,Permianville Royalty Trust Trust Units ,$1.68,0.03,1.82%,55440000,United States,2011,22427,Energy,Oil & Gas Production
PWR,Quanta Services Inc. Common Stock,$95.35,-0.23,-0.24%,13286649872,United States,,650316,Capital Goods,Engineering & Construction
PXD,Pioneer Natural Resources Company Common Stock,$152.19,0.25,0.17%,37127115908,United States,,1546443,Energy,Oil & Gas Production
PYN,PIMCO New York Municipal Income Fund III Common Shares of Beneficial Interest,$10.64,-0.07,-0.65%,60945920,United States,2002,12658,,
PYS,Merrill Lynch Depositor Inc PPlus Tr Ser RRD-1 Tr Ctf Cl A,$21.635,0.0173,0.08%,0,United States,,2567,Finance,Trusts Except Educational Religious and Charitable
PYT,PPlus Tr GSC-2 Tr Ctf Fltg Rate,$24.0001,0,0.00%,0,United States,,56,,
PZC,PIMCO California Municipal Income Fund III Common Shares of Beneficial Interest,$11.05,-0.1,-0.90%,247310050,United States,2002,53671,,
PZN,Pzena Investment Management Inc Class A Common Stock,$11.60,0.46,4.13%,841783220,United States,2007,220459,Finance,Investment Managers
QD,Qudian Inc. American Depositary Shares each representing one Class A Ordinary Share,$2.07,-0.07,-3.27%,523892570,China,2017,1434571,Technology,Computer Software: Prepackaged Software
QFTA,Quantum FinTech Acquisition Corporation Common Stock,$9.67,0.01,0.10%,243260938,,2021,9419,,
QGEN,Qiagen N.V. Common Shares ,$49.36,0.22,0.45%,11274169520,Netherlands,,522135,Health Care,Biotechnology: Biological Products (No Diagnostic Substances)
QS,QuantumScape Corporation Class A Common Stock,$25.89,-0.36,-1.37%,10510665384,United States,2020,16195394,Capital Goods,Auto Parts:O.E.M.
QSR,Restaurant Brands International Inc. Common Shares,$69.72,0.35,0.51%,21133056417,Canada,2014,1553159,,
QTS,QTS Realty Trust Inc. Class A Common Stock,$63.38,0.69,1.10%,4367005591,United States,2013,348205,Consumer Services,Real Estate Investment Trusts
QTS^A,QTS Realty Trust Inc. 7.125% Series A Cumulative Redeemable Perpetual Preferred Stock,$27.25,0.15,0.55%,,United States,,9528,,
QTS^B,QTS Realty Trust Inc. 6.50% Series B Cumulative Convertible Perpetual Preferred Stock,$142.93,0.28,0.20%,,United States,,1419,,
QTWO,Q2 Holdings Inc. Common Stock,$94.93,-0.97,-1.01%,5345063078,,2014,416549,Technology,EDP Services
QUAD,Quad Graphics Inc Class A Common Stock,$3.31,-0.03,-0.90%,180992144,United States,,151602,Consumer Services,Recreational Products/Toys
QUOT,Quotient Technology Inc. Common Stock,$11.76,0.7,6.33%,1097942177,,2014,2363099,Technology,Advertising
QVCC,QVC Inc. 6.250% Senior Secured Notes due 2068,$26.02,-0.03,-0.12%,0,United States,2019,43626,,
QVCD,QVC Inc. 6.375% Senior Secured Notes due 2067,$25.87,-0.12,-0.46%,0,United States,2018,20612,,
R,Ryder System Inc. Common Stock,$81.79,-0.82,-0.99%,4406058953,United States,,324908,Miscellaneous,Rental/Leasing Companies
RA,Brookfield Real Assets Income Fund Inc. Common Stock,$21.73,0.18,0.84%,953792782,,2016,200227,,
RAAS,Cloopen Group Holding Limited American Depositary Shares each representing two Class A Ordinary Shares,$9.15,-0.36,-3.79%,1503987092,,2021,895654,Technology,Computer Software: Prepackaged Software
RACE,Ferrari N.V. Common Shares,$210.91,0.91,0.43%,52308151232,,2015,262755,Capital Goods,Auto Manufacturing
RAD,Rite Aid Corporation Common Stock,$18.27,0.08,0.44%,1006745366,United States,,1575901,Health Care,Medical/Nursing Services
RAMP,LiveRamp Holdings Inc. Common Stock,$50.24,0.58,1.17%,3362031209,United States,2018,735087,Technology,EDP Services
RBA,Ritchie Bros. Auctioneers Incorporated Common Stock,$59.71,-0.52,-0.86%,6584855283,Canada,,544138,,
RBAC,RedBall Acquisition Corp. Class A Ordinary Shares,$9.80,-0.06,-0.61%,704375000,United States,2020,237879,Finance,Business Services
RBC,Regal Beloit Corporation Common Stock,$142.23,0.94,0.67%,5778792810,United States,,253225,Consumer Durables,Metal Fabrications
RBLX,Roblox Corporation Class A Common Stock,$93.77,-3.7,-3.80%,53433096286,,2021,13439337,Technology,EDP Services
RC,Ready Capital Corproation Common Stock,$15.22,0.17,1.13%,1083994259,United States,2013,390541,Consumer Services,Real Estate Investment Trusts
RC^B,Ready Capital Corporation 8.625% Series B Cumulative Preferred Stock,$25.465,0,0.00%,,United States,,2,,
RC^C,Ready Capital Corporation 6.25% Series C Cumulative Convertible Preferred Stock,$24.99,-0.01,-0.04%,,United States,,616,,
RC^D,Ready Capital Corporation 7.625% Series D Cumulative Redeemable Preferred Stock,$25.34,0.06,0.24%,,United States,,13777,,
