Ticker,Name,Last Sale,Net Change,% Change,Market Cap,Country,IPO Year,Volume,Sector,Industry
JPM^G,J P Morgan Chase & Co Depositary Shares each representing a 1/400th interest in a share of 6.10% Non-Cumulative Preferred Stock Series AA,$25.03,0.04,0.16%,,United States,,512054,,
JPM^H,J P Morgan Chase & Co Depositary Shares each representing a 1/400th interest in a share of 6.15% Non-Cumulative Preferred Stock Series BB,$25.03,0.04,0.16%,,United States,,321727,,
JPM^J,J P Morgan Chase & Co Depositary Shares each representing a 1/400th interest in a share of JPMorgan Chase & Co. 4.75% Non-Cumulative Preferred Stock Series GG,$26.14,0,0.00%,,United States,,235306,,
JPM^K,J P Morgan Chase & Co Depositary Shares each representing a 1/400th interest in a share of 4.55% Non-Cumulative Preferred Stock Series JJ,$25.87,-0.03,-0.12%,,United States,,364409,,
JPM^L,J P Morgan Chase & Co Depositary Shares each representing a 1/400th interest in a share of 4.625% Non-Cumulative Preferred Stock Series LL,$26.25,0.27,1.04%,,United States,,10807703,,
JPS,Nuveen Preferred & Income Securities Fund,$9.90,0.07,0.71%,2017522455,United States,2002,191666,,
JPT,Nuveen Preferred and Income 2022 Term Fund Common Shares of Beneficial Interest,$24.83,0.11,0.45%,169863818,United States,2017,12516,,
JQC,Nuveen Credit Strategies Income Fund Shares of Beneficial Interest,$6.56,0.01,0.15%,889596942,United States,2003,454725,,
JRI,Nuveen Real Asset Income and Growth Fund Common Shares of Beneficial Interest,$16.02,0.08,0.50%,439807954,United States,2012,62237,,
JRO,Nuveen Floating Rate Income Opportuntiy Fund Shares of Beneficial Interest,$9.49,0,0.00%,384736159,United States,2004,148847,,
JRS,Nuveen Real Estate Income Fund Common Shares of Beneficial Interest,$10.69,-0.25,-2.29%,308860515,United States,2001,730622,,
JSD,Nuveen Short Duration Credit Opportunities Fund Common Shares of Beneficial Interest,$14.37,-0.09,-0.62%,144930762,United States,2011,28226,Finance,Finance Companies
JT,Jianpu Technology Inc. American depositary shares,$2.69,-0.21,-7.24%,56977896,,2017,124947,Technology,EDP Services
JTA,Nuveen Tax-Advantaged Total Return Strategy Fund Common Share of Beneficial Interest,$11.69,0.16,1.39%,161916986,United States,2004,18750,,
JTD,Nuveen Tax-Advantaged Dividend Growth Fund Common Shares of Beneficial Interest,$16.13,0.01,0.06%,233632404,United States,,43145,,
JW/A,John Wiley & Sons Inc.,$63.38,0.09,0.14%,,United States,,153284,,
JW/B,John Wiley & Sons Inc.,$62.92,0,0.00%,,United States,,10,,
JWN,Nordstrom Inc. Common Stock,$33.54,-0.76,-2.22%,5329506000,United States,,6092070,Consumer Services,Clothing/Shoe/Accessory Stores
JWS,Jaws Acquisition Corp. Class A Ordinary Shares,$14.51,0.44,3.13%,1251487500,,2020,420384,Finance,Business Services
JWSM,Jaws Mustang Acquisition Corp. Class A Ordinary Shares,$9.77,0.02,0.21%,1263993750,,2021,17867,Finance,Business Services
K,Kellogg Company Common Stock,$65.49,-0.05,-0.08%,22299105045,United States,,2724172,Consumer Non-Durables,Packaged Foods
KAHC,KKR Acquisition Holdings I Corp. Class A Common Stock,$9.74,0.01,0.10%,1680150000,,2021,98700,,
KAI,Kadant Inc Common Stock,$168.02,1.01,0.61%,1945298596,United States,,26224,Technology,Industrial Machinery/Components
KAMN,Kaman Corporation Common Stock,$53.82,0.54,1.01%,1496737214,United States,,93160,Capital Goods,Military/Government/Technical
KAR,KAR Auction Services Inc Common Stock,$17.94,-0.02,-0.11%,2238214134,United States,2009,1692992,,
KB,KB Financial Group Inc,$51.49,1.12,2.22%,20062271909,South Korea,,149910,Finance,Commercial Banks
KBH,KB Home Common Stock,$46.81,-0.14,-0.30%,4621911269,United States,1986,727090,,
KBR,KBR Inc. Common Stock,$40.74,-0.05,-0.12%,5758444147,United States,2006,644054,Capital Goods,Oilfield Services/Equipment
KCAC,Kensington Capital Acquisition Corp. II Class A Common Stock,$9.86,-0.08,-0.81%,283475000,,2021,15641,,
KEN,Kenon Holdings Ltd. Ordinary Shares,$36.20,-0.25,-0.69%,1950424035,Singapore,2015,18669,Public Utilities,Electric Utilities: Central
KEP,Korea Electric Power Corporation Common Stock,$11.48,-0.15,-1.29%,14739495208,South Korea,1994,218725,Public Utilities,Electric Utilities: Central
KEX,Kirby Corporation Common Stock,$65.33,0.06,0.09%,3926659650,United States,,156360,Transportation,Marine Transportation
KEY,KeyCorp Common Stock,$23.04,-0.23,-0.99%,22360767852,United States,,5004420,Finance,Major Banks
KEY^I,KeyCorp Depositary Shares Each Representing a 1/40th Ownership Interest in a Share of Fixed-to-Floating Rate Perpetual Non-Cumulative Preferred Stock Series E,$30.39,0.07,0.23%,,United States,,59628,,
KEY^J,KeyCorp Depositary Shares each representing a 1/40th ownership interest in a share of Fixed Rate Perpetual Non-Cumulative Preferred Stock Series F,$27.12,0.02,0.07%,,United States,,33280,,
KEY^K,KeyCorp Depositary Shares each representing a 1/40th ownership interest in a share of Fixed Rate Perpetual Non-Cumulative Preferred Stock Series G,$27.47,0.17,0.62%,,United States,,53272,,
KEYS,Keysight Technologies Inc. Common Stock,$142.38,1.84,1.31%,26269110000,United States,2014,785167,Capital Goods,Industrial Machinery/Components
KF,Korea Fund Inc. (The) New Common Stock,$45.36,0.45,1.00%,227706111,United States,,2948,,
KFS,Kingsway Financial Services Inc. Common Stock (DE),$4.98,0.11,2.26%,118054042,Canada,,6232,,
KFY,Korn Ferry Common Stock,$65.41,-0.71,-1.07%,3532582760,United States,1999,128015,Technology,Diversified Commercial Services
KGC,Kinross Gold Corporation Common Stock,$8.10,0.13,1.63%,10215720000,Canada,,9689344,Basic Industries,Precious Metals
KIM,Kimco Realty Corporation Common Stock,$21.31,0.34,1.62%,9237015595,United States,,4093084,Consumer Services,Real Estate Investment Trusts
KIM^L,Kimco Realty Corporation Class L Depositary Shares each of which represents a one-one thousandth fractional interest in a share of 5.125% Class L Cumulative Redeemable Preferred Stock liquidation preference $25000.00 per share,$26.36,0.23,0.88%,,United States,,15851,,
KIM^M,Kimco Realty Corporation Class M Depositary Shares each of which represents a one-one thousandth fractional interest in a share of 5.25% Class M Cumulative Redeemable Preferred Stock liquidation preference $25000.00 per share,$26.21,-0.104,-0.40%,,United States,,36245,,
KIO,KKR Income Opportunities Fund Common Shares,$16.48,0.05,0.30%,335208391,,2013,68080,,
KKR,KKR & Co. Inc. Common Stock,$55.69,-0.01,-0.02%,32399258309,United States,,2246955,Finance,Investment Managers
KKR^A,KKR & Co. Inc. 6.75% Series A Preferred Stock,$25.03,-0.38,-1.50%,,United States,,31342,,
KKR^B,KKR & Co. Inc. 6.50% Series B Preferred Stock,$25.37,-0.39,-1.51%,,United States,,12614,,
KKR^C,KKR & Co. Inc. 6.00% Series C Mandatory Convertible Preferred Stock,$74.31,-0.89,-1.18%,,United States,,26280,,
KKRS,KKR Group Finance Co. IX LLC 4.625% Subordinated Notes due 2061,$25.65,0.11,0.43%,0,,2021,65162,,
KL,Kirkland Lake Gold Ltd. Common Shares,$43.33,-0.6,-1.37%,11572657644,,,1603876,,
KMB,Kimberly-Clark Corporation Common Stock,$130.63,-2.23,-1.68%,44078688340,United States,,4278070,Basic Industries,Paper
KMF,Kayne Anderson NextGen Energy & Infrastructure Inc.,$7.17,-0.02,-0.28%,338405803,,2010,61916,,
KMI,Kinder Morgan Inc. Common Stock,$18.34,0.08,0.44%,41532444572,United States,2011,12715581,Public Utilities,Natural Gas Distribution
KMPR,Kemper Corporation,$74.87,0.42,0.56%,4834094304,United States,,388612,Finance,Property-Casualty Insurers
KMT,Kennametal Inc. Common Stock,$37.51,-0.49,-1.29%,3135785324,United States,,679263,Capital Goods,Industrial Machinery/Components
KMX,CarMax Inc,$115.19,-0.6,-0.52%,18793379356,United States,,535072,Consumer Services,Other Specialty Stores
KN,Knowles Corporation Common Stock,$20.54,0.03,0.15%,1905977463,,2014,628822,Consumer Non-Durables,Consumer Electronics/Appliances
KNL,Knoll Inc. Common Stock,$26.00,0.03,0.12%,1321129680,United States,2004,300926,,
KNOP,KNOT Offshore Partners LP Common Units representing Limited Partner Interests,$18.98,0.04,0.21%,620533904,United Kingdom,2013,116543,Transportation,Marine Transportation
KNX,Knight-Swift Transportation Holdings Inc.,$47.73,-0.23,-0.48%,7899823706,United States,2017,1021060,Transportation,Trucking Freight/Courier Services
KO,Coca-Cola Company (The) Common Stock,$55.29,-0.2,-0.36%,2.38362E+11,United States,,17011593,Consumer Non-Durables,Beverages (Production/Distribution)
KODK,Eastman Kodak Company Common New,$7.12,-0.3,-4.04%,558944749,United States,,2855742,Miscellaneous,Business Services
KOF,Coca Cola Femsa S.A.B. de C.V.  American Depositary Shares each representing 10 Units (each Unit consists of 3 Series B Shares and 5 Series L Shares),$49.02,0.85,1.77%,10298279739,Mexico,1993,143079,Consumer Non-Durables,Beverages (Production/Distribution)
KOP,Koppers Holdings Inc. Koppers Holdings Inc. Common Stock,$34.67,0.35,1.02%,736420651,United States,2006,82597,Basic Industries,Industrial Specialties
KOS,Kosmos Energy Ltd. Common Shares (DE),$3.18,-0.04,-1.24%,1297593642,Bermuda,2011,6024226,Energy,Oil & Gas Production
KR,Kroger Company (The) Common Stock,$36.98,0.69,1.90%,27997590099,United States,,11356622,Consumer Services,Food Chains
KRA,Kraton Corporation Common Stock,$33.95,-0.85,-2.44%,1091290396,United States,2009,206004,Basic Industries,Major Chemicals
KRC,Kilroy Realty Corporation Common Stock,$70.21,0.73,1.05%,8175980478,United States,1997,732015,Consumer Services,Real Estate Investment Trusts
KREF,KKR Real Estate Finance Trust Inc. Common Stock,$21.38,0.16,0.75%,1189529322,United States,2017,325232,Consumer Services,Real Estate Investment Trusts
KREF^A,KKR Real Estate Finance Trust Inc. 6.50% Series A Cumulative Redeemable Preferred Stock,$25.62,-0.185,-0.72%,,United States,,282856,,
KRG,Kite Realty Group Trust Common Stock,$21.20,0.08,0.38%,1791092176,United States,2004,288758,Consumer Services,Real Estate Investment Trusts
KRO,Kronos Worldwide Inc Common Stock,$16.24,-0.09,-0.55%,1876413724,United States,,177852,Basic Industries,Major Chemicals
KRP,Kimbell Royalty Partners Common Units Representing Limited Partner Interests,$12.71,0.07,0.55%,763644228,United States,2017,86748,Energy,Oil & Gas Production
KSM,DWS Strategic Municipal Income Trust,$12.29,-0.1,-0.81%,137696435,United States,1989,12691,,
KSS,Kohl's Corporation Common Stock,$55.49,-1.26,-2.22%,8744815427,United States,1992,3712648,Consumer Services,Department/Specialty Retail Stores
KSU,Kansas City Southern Common Stock,$297.68,2.32,0.79%,27069260507,United States,,986015,Transportation,Railroads
KSU^,Kansas City Southern Preferred Stock,$37.125,0.375,1.02%,,United States,,93,,
KT,KT Corporation Common Stock,$15.11,0.33,2.23%,7186272000,South Korea,,1070155,Public Utilities,Telecommunications Equipment
KTB,Kontoor Brands Inc. Common Stock ,$64.02,-1.57,-2.39%,3689568310,,2019,371809,,
KTF,DWS Municipal Income Trust,$12.06,0.06,0.50%,476381312,United States,1988,67463,,
KTH,Structures Products Cp 8% CorTS Issued by Peco Energy Cap Tr II Preferred Stock,$33.07,0.3,0.92%,0,United States,,200,Finance,Investment Managers
KTN,Structured Products Corp 8.205% CorTS 8.205% Corporate Backed Trust Securities (CorTS),$33.84,0.46,1.38%,0,United States,,2226,,
KUKE,Kuke Music Holding Limited American Depositary Shares each representing one Ordinary Share,$6.66,0.41,6.56%,196914375,,2021,125512,Consumer Services,Other Consumer Services
KW,Kennedy-Wilson Holdings Inc. Common Stock,$19.84,-0.01,-0.05%,2792874062,United States,,430654,Consumer Services,Real Estate
KWAC,Kingswood Acquisition Corp. Class A Common Stock,$9.99,0.0061,0.06%,144645210,,2021,1654,,
KWR,Quaker Chemical Corporation Common Stock,$242.55,0.51,0.21%,4335176434,United States,,55648,Basic Industries,Automotive Aftermarket
KYN,Kayne Anderson Energy Infrastructure Fund Inc.,$8.23,-0.11,-1.32%,1040663369,United States,2004,394899,,
L,Loews Corporation Common Stock,$58.38,0.2,0.34%,15364191003,United States,,724391,Finance,Property-Casualty Insurers
LAC,Lithium Americas Corp. Common Shares,$15.30,0.37,2.48%,1833918588,Canada,,2503167,,
LAD,Lithia Motors Inc. Common Stock,$351.99,-6.12,-1.71%,10708510460,United States,,368150,Consumer Services,Other Specialty Stores
LADR,Ladder Capital Corp Class A Common Stock,$11.70,-0.17,-1.43%,1478202500,,2014,331949,Consumer Services,Real Estate Investment Trusts
LAIX,LAIX Inc. American Depositary Shares each  representing one Class A Ordinary Share,$1.80,-0.19,-9.55%,89602810,,2018,2852996,Miscellaneous,Service to the Health Industry
LAZ,Lazard LTD. Lazard LTD. Class A Common Stock,$47.18,0.59,1.27%,4970884564,Bermuda,2005,371406,Finance,Investment Managers
LB,L Brands Inc.,$69.87,0.43,0.62%,19486592989,United States,,3629033,Consumer Services,Clothing/Shoe/Accessory Stores
LBRT,Liberty Oilfield Services Inc. Class A Common Stock,$14.96,-0.01,-0.07%,2695356993,United States,2018,435059,Energy,Oilfield Services/Equipment
LC,LendingClub Corporation Common Stock,$15.28,0.05,0.33%,1485645765,United States,2014,1303624,Finance,Finance Companies
LCI,Lannett Co Inc Common Stock,$4.30,-0.64,-12.96%,178217856,United States,,2997859,Health Care,Major Pharmaceuticals
LCII,LCI Industries,$149.05,0.05,0.03%,3764175027,United States,,84808,Capital Goods,Auto Parts:O.E.M.
LDI,loanDepot Inc. Class A Common Stock,$16.95,0.8,4.95%,5218106011,,2021,140704,Finance,Finance: Consumer Services
LDL,Lydall Inc. Common Stock,$36.38,-0.49,-1.33%,655531038,United States,,44831,Technology,Industrial Machinery/Components
LDOS,Leidos Holdings Inc. Common Stock,$102.75,-0.16,-0.16%,14530921337,United States,,745108,Technology,EDP Services
LDP,Cohen & Steers Limited Duration Preferred and Income Fund Inc.,$26.77,0.09,0.34%,774292562,United States,2012,27490,,
LEA,Lear Corporation Common Stock,$193.36,0.83,0.43%,11628002535,United States,,365205,Capital Goods,Auto Parts:O.E.M.
LEAF,Leaf Group Ltd. Common Stock,$8.44,-0.01,-0.12%,304110882,United States,,595637,Technology,EDP Services
LEAP,Ribbit LEAP Ltd. Class A Ordinary Shares,$10.59,0.09,0.86%,619567950,United States,2020,13003,Finance,Business Services
LEG,Leggett & Platt Incorporated Common Stock,$55.03,-0.17,-0.31%,7331795261,United States,,413368,Consumer Durables,Home Furnishings
LEJU,Leju Holdings Limited American Depositary Shares each representing one Ordinary share,$2.04,0.02,0.99%,278281712,,2014,188731,Finance,Real Estate
LEN,Lennar Corporation Class A Common Stock,$99.01,0.06,0.06%,31027913503,United States,,1465680,Consumer Services,Building operators
LEO,BNY Mellon Strategic Municipals Inc. Common Stock,$8.95,0.05,0.56%,556777370,United States,1987,128619,,
LEV,The Lion Electric Company Common Shares,$19.07,-0.09,-0.47%,3595039233,,2021,897792,Finance,Business Services
LEVI,Levi Strauss & Co Class A Common Stock,$26.76,-0.53,-1.94%,10713752147,United States,2019,2341412,Basic Industries,Industrial Specialties
LFC,China Life Insurance Company Limited American Depositary Shares,$10.70,0.02,0.19%,60486468700,China,2003,458916,Finance,Life Insurance
LFT,Lument Finance Trust Inc. Common Stock,$3.78,0.01,0.27%,94285988,United States,2013,57185,Consumer Services,Real Estate Investment Trusts
LFT^A,Lument Finance Trust Inc. 7.875% Series A Cumulative Redeemable Preferred Stock,$25.32,0.07,0.28%,,United States,,3251,,
LGI,Lazard Global Total Return and Income Fund Common Stock,$20.529,-0.051,-0.25%,267075331,United States,2004,31074,,
LGV,Longview Acquisition Corp. II Class A Common Stock,$10.02,0.21,2.14%,864225000,,2021,24246,,
LH,Laboratory Corporation of America Holdings Common Stock,$274.48,-0.94,-0.34%,26816696000,United States,,487546,Health Care,Medical Specialities
LHC,Leo Holdings Corp. II Class A Ordinary Shares,$9.73,-0.02,-0.21%,456093750,,2021,17779,Finance,Business Services
LHX,L3Harris Technologies Inc. Common Stock,$218.06,-0.85,-0.39%,44698772225,United States,,824409,Capital Goods,Industrial Machinery/Components
LII,Lennox International Inc. Common Stock,$349.93,3.16,0.91%,13219184184,United States,1999,135243,Capital Goods,Industrial Machinery/Components
LIII,Leo Holdings III Corp. Class A Ordinary Shares,$9.8375,0,0.00%,0,,2021,2,,
LIN,Linde plc Ordinary Share,$300.60,-0.18,-0.06%,1.56321E+11,,2018,1430900,Basic Industries,Major Chemicals
LINX,Linx S.A. American Depositary Shares each representing one common share,$7.22,0.07,0.98%,1271206520,,2019,12719,Technology,Computer Software: Prepackaged Software
LITB,LightInTheBox Holding Co. Ltd. American Depositary Shares each representing 2 ordinary shares,$2.90,-0.1,-3.33%,324149170,China,2013,221839,Consumer Services,Catalog/Specialty Distribution
LL,Lumber Liquidators Holdings Inc Common Stock,$22.78,-0.15,-0.65%,661204034,United States,2007,448599,Consumer Services,RETAIL: Building Materials
LLY,Eli Lilly and Company Common Stock,$199.74,0.54,0.27%,1.91556E+11,United States,,2386010,Health Care,Major Pharmaceuticals
LMND,Lemonade Inc. Common Stock,$90.47,4.47,5.20%,5555711675,United States,2020,2568000,Finance,Property-Casualty Insurers
LMT,Lockheed Martin Corporation Common Stock,$382.20,-5.19,-1.34%,1.06226E+11,United States,,935537,Capital Goods,Aerospace
LNC,Lincoln National Corporation Common Stock,$69.79,-0.05,-0.07%,13286145349,United States,,1013886,Finance,Life Insurance
LND,Brasilagro Brazilian Agric Real Estate Co Sponsored ADR (Brazil),$6.0491,0.0691,1.16%,478985432,Brazil,,9215,Consumer Non-Durables,Farming/Seeds/Milling
LNFA,L&amp;F Acquisition Corp. Class A Ordinary Shares,$9.93,-0.01,-0.10%,214110660,United States,2021,58430,Finance,Business Services
LNN,Lindsay Corporation Common Stock,$164.63,0.4,0.24%,1795551912,United States,,30669,Capital Goods,Industrial Machinery/Components
LOKB,Live Oak Acquisition Corp. II Class A Common Stock,$9.90,0,0.00%,313087500,,2021,110116,,
LOKM,Live Oak Mobility Acquisition Corp. Class A Common Stock,$9.74,-0.01,-0.10%,308027500,,2021,2055,,
LOMA,Loma Negra Compania Industrial Argentina Sociedad Anonima ADS,$6.65,0.26,4.07%,792680000,Argentina,2017,202497,Capital Goods,Building Materials
LOW,Lowe's Companies Inc. Common Stock,$194.83,1.06,0.55%,1.39303E+11,United States,,3619389,Consumer Services,RETAIL: Building Materials
LPG,Dorian LPG Ltd. Common Stock,$14.21,0.01,0.07%,589457003,,2014,352957,Transportation,Marine Transportation
LPI,Laredo Petroleum Inc. Common Stock,$56.16,0.23,0.41%,724397900,United States,2011,328412,Energy,Oil & Gas Production
LPL,LG Display Co Ltd AMERICAN DEPOSITORY SHARES,$10.66,0.43,4.20%,7628630724,South Korea,2004,2810547,Capital Goods,Industrial Machinery/Components
LPX,Louisiana-Pacific Corporation Common Stock,$67.21,-0.84,-1.23%,6872445301,United States,,1211381,,
LRN,Stride Inc. Common Stock,$26.88,-0.05,-0.19%,1116648476,United States,,327775,Miscellaneous,Other Consumer Services
LSI,Life Storage Inc. Common Stock,$99.44,1.18,1.20%,7642502666,United States,,407718,Consumer Services,Real Estate Investment Trusts
LSPD,Lightspeed POS Inc. Subordinate Voting Shares,$71.99,-0.84,-1.15%,9450735112,,,655518,,
LTC,LTC Properties Inc. Common Stock,$39.18,0.02,0.05%,1542305890,United States,,347263,Consumer Services,Real Estate Investment Trusts
LTHM,Livent Corporation Common Stock,$19.51,-0.37,-1.86%,2859496573,United States,2018,2270828,Basic Industries,Industrial Specialties
LU,Lufax Holding Ltd American Depositary Shares two of which representing one Ordinary Share,$12.19,-0.17,-1.38%,30015450653,China,2020,5909154,Finance,Finance: Consumer Services
LUB,Luby's Inc. Common Stock,$3.69,-0.01,-0.27%,113646369,United States,,39443,Consumer Services,Restaurants
LUMN,Lumen Technologies Inc. Common Stock,$13.84,-0.37,-2.60%,15297525526,United States,,9444884,Public Utilities,Telecommunications Equipment
LUV,Southwest Airlines Company Common Stock,$61.46,-0.27,-0.44%,36346004361,United States,,3517047,Transportation,Air Freight/Delivery Services
LVS,Las Vegas Sands Corp. Common Stock,$57.75,-0.81,-1.38%,44118958422,United States,2004,5644433,Consumer Services,Hotels/Resorts
LW,Lamb Weston Holdings Inc. Common Stock ,$82.49,2.24,2.79%,12066838393,,2016,947564,Consumer Non-Durables,Specialty Foods
LXP,Lexington Realty Trust Common Stock,$12.38,0.03,0.24%,3635119258,United States,,1375820,,
LXP^C,Lexington Realty Trust  Preferred Conv. Series C,$60.30,1.05,1.77%,,United States,,2391,,
LXU,LSB Industries Inc. Common Stock,$6.29,-0.22,-3.38%,188937441,United States,,86740,Basic Industries,Industrial Specialties
LYB,LyondellBasell Industries NV Ordinary Shares Class A (Netherlands),$112.62,-0.94,-0.83%,37654943200,Netherlands,,1600919,Basic Industries,Major Chemicals
LYG,Lloyds Banking Group Plc American Depositary Shares,$2.81,-0.02,-0.71%,49845433463,United Kingdom,,4481064,Finance,Commercial Banks
LYV,Live Nation Entertainment Inc. Common Stock,$90.11,-0.41,-0.45%,19705546126,United States,,1086164,Consumer Services,Movies/Entertainment
LZB,La-Z-Boy Incorporated Common Stock,$41.23,-0.87,-2.07%,1908812652,United States,,206358,Consumer Durables,Home Furnishings
M,Macy's Inc Common Stock,$18.28,-0.59,-3.13%,5685080000,United States,,11511049,Consumer Services,Department/Specialty Retail Stores
MA,Mastercard Incorporated Common Stock,$360.58,-1.42,-0.39%,3.57352E+11,United States,2006,3624319,Miscellaneous,Business Services
MAA,Mid-America Apartment Communities Inc. Common Stock,$160.70,2.32,1.47%,18398026189,United States,1994,506643,Consumer Services,Real Estate Investment Trusts
MAA^I,Mid-America Apartment Communities Inc. 8.50% Series I Cumulative Redeemable Preferred Stock,$67.8069,-0.9651,-1.40%,,United States,,300,,
MAC,Macerich Company (The) Common Stock,$15.91,-0.24,-1.49%,3285705135,United States,1994,4555065,Consumer Services,Real Estate Investment Trusts
MACC,Mission Advancement Corp. Class A Common Stock,$9.71,-0.08,-0.82%,418743750,,2021,105,,
MAIN,Main Street Capital Corporation Common Stock,$41.12,0.02,0.05%,2805483261,United States,2007,211042,Finance,Finance/Investors Services
MAN,ManpowerGroup Common Stock,$120.99,-2.34,-1.90%,6597067105,United States,,302225,Technology,Professional Services
MANU,Manchester United Ltd. Class A Ordinary Shares,$15.63,-0.19,-1.20%,2546739587,United Kingdom,2012,226021,Consumer Services,Movies/Entertainment
MAS,Masco Corporation Common Stock,$60.31,-0.16,-0.27%,15305824734,United States,,1519690,Capital Goods,Building Products
MATX,Matson Inc. Common Stock,$64.65,0.98,1.54%,2808111993,United States,,172832,Transportation,Marine Transportation
MAV,Pioneer Municipal High Income Advantage Fund Inc.,$12.16,0.03,0.25%,290612083,United States,,26299,,
MAX,MediaAlpha Inc. Class A Common Stock,$42.32,2.34,5.85%,2526597146,,2020,310937,Capital Goods,Industrial Machinery/Components
MAXR,Maxar Technologies Inc.,$31.10,-0.89,-2.78%,2234914731,,,529970,Capital Goods,Telecommunications Equipment
MBAC,M3-Brigade Acquisition II Corp. Class A Common Stock,$9.65,-0.05,-0.52%,496975000,,2021,11765,,
MBI,MBIA Inc. Common Stock,$9.99,-0.11,-1.09%,542948138,United States,1987,225006,Finance,Property-Casualty Insurers
MBT,Mobile TeleSystems PJSC,$9.12,0.03,0.33%,7874923820,Russia,,2833023,Public Utilities,Telecommunications Equipment
MC,Moelis & Company Class A Common Stock,$53.69,0.23,0.43%,3292713098,,2014,161981,,
MCA,Blackrock MuniYield California Quality Fund Inc. Common Stock,$15.32,0.1001,0.66%,527095584,United States,1992,26350,,
MCB,Metropolitan Bank Holding Corp. Common Stock,$63.81,0.08,0.13%,532413794,,2017,20811,Finance,Major Banks
MCD,McDonald's Corporation Common Stock,$233.89,-0.97,-0.41%,1.74523E+11,United States,,2853552,Consumer Services,Restaurants
MCI,Barings Corporate Investors Common Stock,$14.90,-0.1001,-0.67%,301899613,United States,,29511,,
MCK,McKesson Corporation Common Stock,$192.39,-1.92,-0.99%,30433457832,United States,,1265395,Health Care,Other Pharmaceuticals
MCN,Madison Covered Call & Equity Strategy Fund Common Stock,$8.16,-0.05,-0.61%,170926900,United States,2004,101270,,
MCO,Moody's Corporation Common Stock,$335.35,1.62,0.49%,62777520000,United States,,724714,Technology,Advertising
MCR,MFS Charter Income Trust Common Stock,$8.79,-0.03,-0.34%,389528604,United States,1989,230670,,
MCS,Marcus Corporation (The) Common Stock,$21.11,0.07,0.33%,662661857,United States,,372177,Consumer Services,Movies/Entertainment
MCY,Mercury General Corporation Common Stock,$63.60,0.13,0.21%,3521582117,United States,,127908,Finance,Property-Casualty Insurers
MD,Mednax Inc. Common Stock,$31.98,-0.51,-1.57%,2759181665,United States,,781388,Health Care,Medical Specialities
MDC,M.D.C. Holdings Inc. Common Stock,$57.95,-0.42,-0.72%,4071991484,United States,,629165,Capital Goods,Homebuilding
MDH,MDH Acquisition Corp. Class A Common Stock,$9.61,0,0.00%,331545000,,2021,55,,
MDLA,Medallia Inc. Common Stock,$25.67,-0.26,-1.00%,4032990777,United States,2019,1204133,Technology,EDP Services
MDLQ,Medley LLC 7.25% Notes due 2024,$2.51,-0.35,-12.24%,0,,2017,95447,,
MDLX,Medley LLC 6.875% Senior Notes due 2026,$2.45,-0.385,-13.58%,0,,2016,68498,,
MDLY,Medley Management Inc. Class A Common Stock,$4.52,-0.53,-10.50%,13839648,United States,2014,555532,Finance,Finance/Investors Services
MDP,Meredith Corporation Common Stock,$33.68,-0.34,-1.00%,1537771847,United States,,284908,Consumer Services,Newspapers/Magazines
MDT,Medtronic plc. Ordinary Shares,$126.59,1.44,1.15%,1.70653E+11,United States,,5530009,Health Care,Biotechnology: Electromedical & Electrotherapeutic Apparatus
MDU,MDU Resources Group Inc. Common Stock (Holding Company),$33.66,0.12,0.36%,6772208115,United States,,542594,Capital Goods,Building Materials
MEC,Mayville Engineering Company Inc. Common Stock,$19.44,0.2,1.04%,396449057,,2019,30000,Capital Goods,Metal Fabrications
MED,MEDIFAST INC Common Stock,$332.25,1.72,0.52%,3907626804,United States,,86321,Miscellaneous,Other Consumer Services
MEG,Montrose Environmental Group Inc. Common Stock,$50.14,-0.1,-0.20%,1306434152,United States,2020,87693,,
MEI,Methode Electronics Inc. Common Stock,$48.38,-0.38,-0.78%,1860053184,United States,,108341,Capital Goods,Electrical Products
